"folder","referenced_file","file_kind","source_type","release_decision","recommended_action","validation_required","issue"
"Assets/BuildingMaterials","","","replace_with_project_owned","removed_from_repo","Downloaded-looking material/texture folder removed from the repo. Add only original or verified redistributable materials going forward.","Regenerate risky-reference CSV and run Unity scene validation after removal.","#2"
"Assets/Fantasy Skybox FREE","","","import_from_asset_store","removed_from_repo","Bundled Asset Store skybox files removed from the repo. Private users can reacquire/import separately if they need the old visuals.","Regenerate risky-reference CSV and run Unity scene validation after removal.","#2"
"Assets/Fresh_Raystore","","","import_from_asset_store","removed_from_repo","Bundled Asset Store cashier/store prop files removed from the repo. Private users can reacquire/import separately if needed.","Regenerate risky-reference CSV and run Unity scene validation after removal.","#2"
"Assets/Lana Studio","","","replace_or_confirm_source","removed_from_repo","Bundled publisher-style assets removed from the repo. Replace with original or verified redistributable visual effects if needed.","Regenerate risky-reference CSV and run Unity scene validation after removal.","#2"
"Assets/Samples","","","import_from_unity_registry","removed_from_repo","Bundled XR sample assets removed from the repo. Reconstruct through Unity Package Manager sample import only if needed privately.","Regenerate risky-reference CSV and run Unity scene validation after removal.","#2"
"Assets/Sprites","","","replace_with_project_owned","removed_from_repo","Uncertain bundled sprite folder removed from the repo. Add only original 21Verse or verified redistributable UI art going forward.","Regenerate asset and risky-reference CSVs and run Unity scene validation after removal.","#2"
"Assets/TextMesh Pro","","","import_from_unity_registry","removed_from_repo","Bundled TextMesh Pro asset folder removed from the repo; the project retains `com.unity.textmeshpro` in `Packages/manifest.json`.","Regenerate risky-reference CSV and run Unity scene validation after removal.","#2"
"Assets/VRTemplateAssets","","","import_from_unity_template_or_replace","removed_from_repo","Bundled VR template-style assets removed from the repo. Reconstruct through Unity template/package setup only if needed privately.","Regenerate risky-reference CSV and run Unity scene validation after removal.","#2"
"Assets/WOC","","","replace_or_confirm_source","removed_from_repo","Bundled unknown-origin model/texture pack removed from the repo. Replace with original or verified redistributable environment assets if visuals are rebuilt.","Regenerate asset and risky-reference CSVs and run Unity scene validation after removal.","#2"
